{
  "schema_version": "1.0",
  "contract_id": "agentsynth.cancel_and_void_payment",
  "contract_version": "1.0.0",
  "task_description": "Cancel order 3 and void the payment attached to it. Both must end up updated; leave order 4 and its payment untouched.",
  "surfaces": [
    {
      "surface_id": "sqlite.orders",
      "kind": "sqlite",
      "mutable": true,
      "scope": "orders table with all columns and rows",
      "observation_boundary": "full",
      "consistency_domain": "run.epoch"
    },
    {
      "surface_id": "sqlite.payments",
      "kind": "sqlite",
      "mutable": true,
      "scope": "payments table with all columns and rows",
      "observation_boundary": "full",
      "consistency_domain": "run.epoch"
    },
    {
      "surface_id": "trace.tools",
      "kind": "trace",
      "mutable": false,
      "scope": "trusted tool invocation order",
      "observation_boundary": "full",
      "consistency_domain": "run.epoch"
    }
  ],
  "frame_policy": {
    "policy": "closed_world",
    "declared_mutation_surfaces": [
      "sqlite.orders",
      "sqlite.payments"
    ],
    "required_coverage_method": "snapshot_pair",
    "allowed_effects": [
      {
        "surface_id": "sqlite.orders",
        "operation": "update",
        "target_pattern": "authorized_row_fields_policy:orders"
      },
      {
        "surface_id": "sqlite.payments",
        "operation": "update",
        "target_pattern": "authorized_row_fields_policy:payments"
      }
    ]
  },
  "obligations": [
    {
      "id": "checker_0",
      "description": "SQL state check: SELECT status FROM orders WHERE id=3",
      "category": "outcome",
      "surface_id": "sqlite.orders",
      "predicate": {
        "operator": "eq",
        "fact_key": "sql.checker_0",
        "expected": "cancelled"
      },
      "required_complete_coverage": []
    },
    {
      "id": "checker_1",
      "description": "SQL state check: SELECT status FROM payments WHERE order_id=3",
      "category": "outcome",
      "surface_id": "sqlite.orders",
      "predicate": {
        "operator": "eq",
        "fact_key": "sql.checker_1",
        "expected": "voided"
      },
      "required_complete_coverage": []
    },
    {
      "id": "checker_2",
      "description": "SQL state check: SELECT status FROM orders WHERE id=4",
      "category": "outcome",
      "surface_id": "sqlite.orders",
      "predicate": {
        "operator": "eq",
        "fact_key": "sql.checker_2",
        "expected": "processing"
      },
      "required_complete_coverage": []
    },
    {
      "id": "checker_3",
      "description": "SQL state check: SELECT status FROM payments WHERE order_id=4",
      "category": "outcome",
      "surface_id": "sqlite.orders",
      "predicate": {
        "operator": "eq",
        "fact_key": "sql.checker_3",
        "expected": "captured"
      },
      "required_complete_coverage": []
    },
    {
      "id": "no_unauthorized_mutation",
      "description": "Absence of persistent modifications outside predeclared task allowlist",
      "category": "frame",
      "surface_id": "sqlite.orders",
      "predicate": {
        "operator": "count_eq",
        "fact_key": "mutation.out_of_frame_count",
        "expected": 0
      },
      "required_complete_coverage": [
        "sqlite.orders",
        "sqlite.payments"
      ]
    }
  ]
}