{"contract_id":"agentsynth.raise_ticket_priority","contract_version":"1.0.0","frame_policy":{"allowed_effects":[{"operation":"update","surface_id":"sqlite.tickets","target_pattern":"adapter_authorized_row_field_policy"}],"declared_mutation_surfaces":["sqlite.tickets"],"policy":"closed_world","required_coverage_method":"snapshot_pair"},"obligations":[{"category":"outcome","description":"Upstream authored SQL checker 0","id":"checker_0","predicate":{"expected":"high","fact_key":"sql.result_0","operator":"eq"},"required_complete_coverage":[],"surface_id":"sqlite.tickets"},{"category":"outcome","description":"Upstream authored SQL checker 1","id":"checker_1","predicate":{"expected":"normal","fact_key":"sql.result_1","operator":"eq"},"required_complete_coverage":[],"surface_id":"sqlite.tickets"},{"category":"frame","description":"All actual persistent modifications within predeclared task-scoped row/field allowlist","id":"no_unauthorized_mutation","predicate":{"expected":0,"fact_key":"mutation.out_of_frame_count","operator":"count_eq"},"required_complete_coverage":["sqlite.tickets"],"surface_id":"sqlite.tickets"}],"schema_version":"1.0","surfaces":[{"consistency_domain":"run.epoch","kind":"sqlite","mutable":true,"observation_boundary":"full","scope":"full table + all fields","surface_id":"sqlite.tickets"}],"task_description":"AgentSynth core_v2 task raise-ticket-priority"}
